{
  "$schema": "https://json-schema.org/draft/2020-12/schema",
  "$id": "household.schema.json",
  "title": "Cast Household",
  "description": "One hand-designed Cast household. All dates are relative to the anchor date so the data never goes stale.",
  "type": "object",
  "required": [ "schemaVersion", "key", "guid", "name", "kind", "origin", "campusSlot", "story", "testPurposes", "members" ],
  "additionalProperties": false,
  "properties": {
    "$schema": { "type": "string" },
    "schemaVersion": { "const": 1 },
    "key": { "type": "string", "pattern": "^[a-z0-9]+(-[a-z0-9]+)*$", "description": "Stable slug. Matches the file name." },
    "guid": { "$ref": "#/$defs/guid", "description": "Family group Guid. Never changes." },
    "name": { "type": "string" },
    "kind": { "enum": [ "family", "business" ] },
    "origin": { "type": "string", "description": "Where the household came from, for example legacy-1.14.1 or new." },
    "campusSlot": { "enum": [ "main" ], "description": "The Cast always lives on the main campus." },
    "duplicateOf": { "type": "string", "description": "The key of the household this is a duplicate record of. Duplicate records never join groups." },
    "story": { "type": "string" },
    "testPurposes": { "type": "array", "items": { "type": "string" }, "minItems": 1 },
    "reviewNotes": { "type": "array", "items": { "type": "string" }, "description": "Open issues to resolve during Cast review." },
    "address": { "$ref": "#/$defs/address" },
    "adultsGiveSeparately": { "type": "boolean", "description": "True when the married couple gives separately: each spouse is their own giving unit with their own giving patterns. Other adults living with a married couple (for example an adult child) always give on their own." },
    "attendance": { "$ref": "#/$defs/attendance" },
    "giving": { "type": "array", "items": { "$ref": "#/$defs/giving" } },
    "campaign": { "type": "array", "items": { "$ref": "#/$defs/campaign" }, "description": "The household's part in the Built on the Rock building campaign (docs/pledges.md): pledges and campaign gifts. Weeks count from Commitment Sunday." },
    "members": { "type": "array", "items": { "$ref": "#/$defs/person" }, "minItems": 1 },
    "sharedMembers": {
      "type": "array",
      "description": "People whose primary record lives in another Cast household but who also belong to this one.",
      "items": {
        "type": "object",
        "required": [ "guid", "household" ],
        "additionalProperties": false,
        "properties": { "guid": { "$ref": "#/$defs/guid" }, "household": { "type": "string" }, "note": { "type": "string" } }
      }
    }
  },
  "$defs": {
    "guid": { "type": "string", "pattern": "^[0-9A-F]{8}-[0-9A-F]{4}-[0-9A-F]{4}-[0-9A-F]{4}-[0-9A-F]{12}$" },
    "relativeDate": {
      "type": "object",
      "description": "A calendar date relative to the anchor. Either yearsAgo, month, and day (the year is the anchor year minus yearsAgo; a result after the anchor moves back one year), or daysAgo alone for recent events that must stay recent.",
      "oneOf": [
        { "required": [ "yearsAgo", "month", "day" ] },
        { "required": [ "daysAgo" ], "not": { "anyOf": [ { "required": [ "yearsAgo" ] }, { "required": [ "month" ] }, { "required": [ "day" ] } ] } }
      ],
      "additionalProperties": false,
      "properties": {
        "daysAgo": { "type": "integer", "minimum": 0 },
        "yearsAgo": { "type": "integer", "minimum": 0 },
        "month": { "type": "integer", "minimum": 1, "maximum": 12 },
        "day": { "type": "integer", "minimum": 1, "maximum": 31 },
        "time": { "type": "string", "pattern": "^[0-2][0-9]:[0-5][0-9]$" }
      }
    },
    "birth": {
      "type": "object",
      "description": "Age on the anchor date plus birthday. The builder picks the birth year that produces this age.",
      "required": [ "age", "month", "day" ],
      "additionalProperties": false,
      "properties": {
        "age": { "type": "integer", "minimum": 0 },
        "month": { "type": "integer", "minimum": 1, "maximum": 12 },
        "day": { "type": "integer", "minimum": 1, "maximum": 31 }
      }
    },
    "address": {
      "type": "object",
      "required": [ "type", "street1", "city", "state", "postalCode" ],
      "additionalProperties": false,
      "properties": {
        "type": { "enum": [ "home", "work", "previous" ] },
        "street1": { "type": "string" },
        "street2": { "type": "string" },
        "city": { "type": "string" },
        "state": { "type": "string" },
        "postalCode": { "type": "string" },
        "latitude": { "type": "number" },
        "longitude": { "type": "number" }
      }
    },
    "attendance": {
      "type": "object",
      "required": [ "persona", "percentAttended" ],
      "additionalProperties": false,
      "properties": {
        "persona": { "enum": [ "core", "regular", "occasional", "holiday-only", "lapsing", "lapsed" ] },
        "percentAttended": { "type": "integer", "minimum": 0, "maximum": 100 },
        "percentPrimaryService": { "type": "integer", "minimum": 0, "maximum": 100 },
        "started": { "$ref": "#/$defs/relativeDate" },
        "ended": { "$ref": "#/$defs/relativeDate" }
      }
    },
    "giving": {
      "type": "object",
      "required": [ "persona", "person", "funds" ],
      "additionalProperties": false,
      "properties": {
        "persona": { "enum": [ "one-time", "occasional", "weekly", "bi-weekly", "monthly", "quarterly", "irregular", "year-end", "lapsing", "new" ] },
        "person": { "type": "string", "description": "Member key of the giver." },
        "currency": { "enum": [ "check", "ach", "card", "cash" ], "description": "Optional payment method. Left out, the profile picks one. A check from someone who does not come on Sundays (a business) arrives by mail." },
        "signer": { "type": "string", "description": "Optional name signed on the check when someone signs for the giver, such as a business owner." },
        "funds": { "type": "object", "additionalProperties": { "type": "number", "minimum": 0 }, "description": "Fund name to amount per gift." },
        "percentOfPeriodsGiven": { "type": "integer", "minimum": 0, "maximum": 100 },
        "growth": {
          "type": "object",
          "additionalProperties": false,
          "properties": { "percent": { "type": "number" }, "everyWeeks": { "type": "integer", "minimum": 1 } }
        },
        "specialGiftPercent": { "type": "integer", "minimum": 0, "maximum": 100 },
        "started": { "$ref": "#/$defs/relativeDate" },
        "ended": { "$ref": "#/$defs/relativeDate" },
        "expect": {
          "type": "object",
          "additionalProperties": false,
          "description": "What Rock should show for this giver after a load, checked by the builder. Use it for the givers a story or a test depends on.",
          "properties": {
            "frequency": { "enum": [ "weekly", "bi-weekly", "monthly", "quarterly", "erratic", "undetermined" ], "description": "Rock's gift frequency label." },
            "journeyStage": { "enum": [ "non-giver", "new", "consistent", "occasional", "lapsed", "former" ], "description": "Rock's current giving journey stage." },
            "alerts": { "type": "array", "items": { "enum": [ "large-gift", "smaller-than-usual", "late-gift" ] }, "description": "Alert types (keys from configuration/giving-alert-types.json) the giver must have at least one of in the alert history." }
          }
        }
      }
    },
    "campaign": {
      "type": "object",
      "required": [ "person" ],
      "additionalProperties": false,
      "properties": {
        "person": { "type": "string", "description": "Member key of the pledger or giver. They must have a giving pattern." },
        "pledge": { "type": "number", "exclusiveMinimum": 0, "description": "The pledge total. Left out, the entries in gifts are campaign gifts with no pledge." },
        "frequency": { "enum": [ "one-time", "weekly", "bi-weekly", "monthly", "quarterly", "yearly" ], "description": "The pledge frequency. Left out, the pledge has none, as Rock allows. A weekly, bi-weekly, monthly, or quarterly pledge is given as a campaign line on the giver's usual gifts of that rhythm." },
        "pledged": {
          "description": "When the pledge was made: in the quiet phase before Commitment Sunday, on Commitment Sunday, or some weeks after. A late pledge starts the day it was made.",
          "oneOf": [
            { "enum": [ "quiet-phase", "commitment-sunday" ] },
            { "type": "object", "required": [ "weeksAfterCommitment" ], "additionalProperties": false, "properties": { "weeksAfterCommitment": { "type": "integer", "minimum": 1 } } }
          ]
        },
        "followThrough": { "enum": [ "paid-in-full", "ahead", "on-pace", "behind", "stopped", "not-started" ], "description": "How the gifts follow the pledge. Paid in full is one gift of the total the week after pledging. Stopped gives on pace until the giver's giving ends." },
        "gifts": {
          "type": "array",
          "description": "Extra campaign gifts, given the way the giver usually gives, or as stock.",
          "items": {
            "type": "object",
            "required": [ "weeksAfterCommitment", "amount" ],
            "additionalProperties": false,
            "properties": { "weeksAfterCommitment": { "type": "integer", "minimum": 0 }, "amount": { "type": "number", "exclusiveMinimum": 0 }, "stock": { "type": "boolean" } }
          }
        },
        "expect": { "enum": [ "complete", "ahead", "on-pace", "behind", "stopped", "not-started", "gifts-only" ], "description": "The pledge state every load must show. Left out, it follows followThrough (paid in full is complete), or is gifts-only when there is no pledge." }
      }
    },
    "person": {
      "type": "object",
      "required": [ "key", "guid", "lastName", "gender", "familyRole", "recordStatus", "connectionStatus" ],
      "$comment": "A person needs a first name. A business record has none, as in Rock: its name is the last name.",
      "if": { "properties": { "recordType": { "const": "business" } }, "required": [ "recordType" ] },
      "else": { "required": [ "firstName" ] },
      "additionalProperties": false,
      "properties": {
        "key": { "type": "string", "pattern": "^[a-z0-9]+(-[a-z0-9]+)*$" },
        "guid": { "$ref": "#/$defs/guid" },
        "recordType": { "enum": [ "person", "business" ] },
        "firstName": { "type": "string" },
        "nickName": { "type": "string" },
        "middleName": { "type": "string" },
        "lastName": { "type": "string" },
        "bio": { "type": "string", "description": "A short backstory for documentation and test writers. Never written to Rock." },
        "previousLastNames": { "type": "array", "items": { "type": "string" } },
        "gender": { "enum": [ "male", "female", "unknown" ] },
        "familyRole": { "enum": [ "adult", "child" ] },
        "birth": { "$ref": "#/$defs/birth" },
        "grade": { "type": "integer", "minimum": -1, "maximum": 12, "description": "School grade on the anchor date (0 = kindergarten)." },
        "graduation": { "$ref": "#/$defs/relativeDate" },
        "maritalStatus": { "enum": [ "married", "single", "divorced", "widowed", "unknown" ] },
        "anniversary": { "$ref": "#/$defs/relativeDate" },
        "recordStatus": { "enum": [ "active", "pending", "inactive" ] },
        "recordStatusReason": { "type": "string" },
        "isDeceased": { "type": "boolean" },
        "connectionStatus": { "enum": [ "Prospect", "Participant", "Known", "Connected", "Engaged", "Leading" ] },
        "email": { "type": "string" },
        "emailIsActive": { "type": "boolean" },
        "emailDoNotEmail": { "type": "boolean" },
        "phones": {
          "type": "object",
          "additionalProperties": false,
          "properties": { "home": { "type": "string" }, "mobile": { "type": "string" }, "work": { "type": "string" } }
        },
        "expect": {
          "type": "object",
          "additionalProperties": false,
          "description": "What Rock should show for this person after a load, checked on every load. Use it for the people a story or a test depends on.",
          "properties": {
            "achievements": {
              "type": "object",
              "additionalProperties": false,
              "description": "Achievement type keys from configuration/achievements.json.",
              "properties": {
                "earned": { "type": "array", "items": { "type": "string" }, "description": "Types the person has earned at least once." },
                "inProgress": { "type": "array", "items": { "type": "string" }, "description": "Types with an open attempt, which check-in shows as in progress." },
                "notEarned": { "type": "array", "items": { "type": "string" }, "description": "Types the person has not earned." }
              }
            },
            "steps": {
              "type": "object",
              "additionalProperties": false,
              "description": "Step type and program keys from configuration/steps.json.",
              "properties": {
                "complete": { "type": "array", "items": { "type": "string" }, "description": "Types with at least one Complete step." },
                "inProgress": { "type": "array", "items": { "type": "string" }, "description": "Types with an In Progress step." },
                "programCompletions": { "type": "array", "items": { "type": "string" }, "description": "The keys of exactly the programs the person has a completion for. An empty list means none." }
              }
            }
          }
        },
        "steps": {
          "type": "object",
          "description": "Steps a story needs, by step type key in configuration/steps.json: a class (Starting Point Class or Foundations), a student event (Student Camp or Mission Trip), the Follow Jesus decision, or Student Leader. Set exactly one of classesAgo, events, or taken. Group, team, giving, and baptism steps come from the person's other records.",
          "additionalProperties": {
            "type": "object",
            "additionalProperties": false,
            "properties": {
              "classesAgo": { "type": "integer", "minimum": 0, "description": "For a class: 0 is the class running on the install day (In Progress), 1 the one before it, and so on." },
              "events": {
                "type": "array",
                "minItems": 1,
                "description": "For an event step, every one the person went to. For a decision, the one event it was made at, which must be one of the person's own events.",
                "items": {
                  "type": "object",
                  "additionalProperties": false,
                  "required": [ "season", "yearsAgo" ],
                  "properties": {
                    "season": { "type": "string", "description": "A season key of the event in configuration/steps.json, such as summer or spring." },
                    "yearsAgo": { "type": "integer", "minimum": 0, "description": "0 is the latest one that ended before the install day, 1 the one a year before it, and so on." }
                  }
                }
              },
              "taken": { "type": "boolean", "description": "True when the person took the step and the usual rules date it." }
            }
          }
        },
        "photo": {
          "type": "object",
          "additionalProperties": false,
          "description": "Inputs for this person's generated photo. Never written to Rock, and never used for names or anything else.",
          "properties": {
            "ethnicity": {
              "enum": [ "white", "black", "hispanic-latino", "east-asian", "southeast-asian", "south-asian", "middle-eastern-north-african", "native-american", "pacific-islander", "multiracial" ],
              "description": "Photo ethnicity, used only to generate a photo that matches the family. Set it on adults. Children inherit a blend of their parents when it is left out; set it on a child only when the blend is wrong (for example, adoption). Prompt wording lives in photos/ethnicities.json."
            },
            "seed": { "type": "integer", "minimum": 0, "description": "Generation seed, recorded after the photo is made, so it can be regenerated." },
            "isOmitted": { "type": "boolean", "description": "True when this person deliberately has no photo, for example a duplicate record created from a form, or a deceased child." }
          }
        },
        "attributes": { "type": "object", "description": "Person attribute values by key. Date values use relativeDate objects." },
        "logins": { "type": "array", "description": "The person's Rock Database logins: the first initial of the first name plus the last name, lowercase, letters and digits only (decision D-logins-1). Every login uses the password chosen at install.", "items": { "type": "string", "pattern": "^[a-z0-9]+$" } },
        "securityRoles": { "type": "array", "items": { "type": "string" } },
        "relationships": {
          "type": "array",
          "items": {
            "type": "object",
            "required": [ "type", "with" ],
            "additionalProperties": false,
            "properties": { "type": { "type": "string" }, "with": { "$ref": "#/$defs/guid" } }
          }
        },
        "follows": {
          "type": "array",
          "items": {
            "type": "object",
            "required": [ "type", "target" ],
            "additionalProperties": false,
            "properties": { "type": { "enum": [ "person", "group" ] }, "target": { "type": "string", "description": "Person Guid, or group key in cast/groups." } }
          }
        },
        "connectionRequests": {
          "type": "array",
          "description": "Requests to serve that tell this person's story (decision 75). The loader adds the activity history. A Connected request adds the person to the team as Pending.",
          "items": {
            "type": "object",
            "required": [ "opportunity", "state", "status", "created", "connector", "comment" ],
            "additionalProperties": false,
            "properties": {
              "opportunity": { "type": "string", "description": "A team key from configuration/serving.json; its opportunity is in configuration/connections.json." },
              "state": { "enum": [ "Active", "Inactive", "FutureFollowUp", "Connected" ] },
              "status": { "type": "string", "description": "A request status name from configuration/connections.json." },
              "created": { "$ref": "#/$defs/relativeDate" },
              "connected": { "$ref": "#/$defs/relativeDate", "description": "When a Connected request connected." },
              "followUpInDays": { "type": "integer", "minimum": 1, "description": "Days after the anchor a FutureFollowUp request comes back." },
              "connector": { "type": "boolean", "description": "Whether the team's leader at the person's campus is the connector." },
              "backgroundCheck": { "enum": [ "Pass", "Fail" ], "description": "A background check result recorded a week after the request." },
              "comment": { "type": "string" }
            }
          }
        }
      }
    }
  }
}
