{
  "$schema": "../household.schema.json",
  "schemaVersion": 1,
  "key": "smith-john-duplicate-b",
  "guid": "1FE1F4F4-1241-4B14-B0D7-39BECFA2F4F8",
  "name": "Smith Family",
  "kind": "family",
  "origin": "legacy-1.14.1",
  "campusSlot": "main",
  "duplicateOf": "smith-jon",
  "story": "A second duplicate of Jon Smith, entered as John, with his home phone saved as a work number.",
  "testPurposes": [
    "Duplicate detection: same email and address, phone stored as a different type."
  ],
  "address": {
    "type": "home",
    "street1": "8194 W Lynwood St",
    "city": "Phoenix",
    "state": "AZ",
    "postalCode": "85043",
    "latitude": 33.464704,
    "longitude": -112.234605
  },
  "members": [
    {
      "key": "john",
      "guid": "C966D4EC-C84A-4F70-BA86-90E1F8480831",
      "firstName": "John",
      "lastName": "Smith",
      "gender": "male",
      "familyRole": "adult",
      "maritalStatus": "single",
      "recordStatus": "pending",
      "connectionStatus": "Connected",
      "email": "jon.smith@example.org",
      "emailIsActive": true,
      "phones": {
        "work": "6235550102"
      },
      "photo": {
        "ethnicity": "hispanic-latino",
        "isOmitted": true
      }
    }
  ]
}
